{
  "$schema": "../../schema/subclass.schema.json",
  "id": "arcane-trickster",
  "classId": "rogue",
  "name": "Trapaceiro Arcano",
  "source": {
    "book": "Livro do Jogador 2024",
    "language": "pt-BR",
    "chapter": 3,
    "chapterTitle": "Classes de Personagem",
    "pdfPath": "doc/livro-jogador.pdf",
    "pdfPages": [
      55,
      182
    ],
    "extractedAt": "2026-06-25T01:13:29.372Z"
  },
  "tagline": "Melhore a furtividade com magia",
  "summary": "Melhorar a furtividade com magia.",
  "description": "Alguns Ladinos aprimoram suas habilidades de furtividade e agilidade com magia, aprendendo truques que\nos auxiliam em seu ofício. Alguns Trapaceiros Arcanos\nutilizam seus talentos para furtos ou assaltos, enquanto outros se dedicam a travessuras.",
  "features": [
    {
      "level": 3,
      "name": "Conjuração",
      "description": "Você aprendeu a conjurar magias. Veja o capítulo 7\npara as regras sobre conjuração de magias. As informações abaixo detalham como você usa essas regras como\num Trapaceiro Arcano.\nTruques. Você conhece três truques: Mãos Mágicas e\ndois outros truques à sua escolha da lista de magias de\nMago (veja a seção desta classe para sua lista). Ilusão\nMenor e Talho Mental são recomendadas.\nAo alcançar um nível de Ladino, você pode substituir\num dos seus truques, exceto Mãos Mágicas, por outro\ntruque de Mago à sua escolha."
    },
    {
      "level": 3,
      "name": "Mãos Mágicas Ligeiras",
      "description": "Ao conjurar Mãos Mágicas, você pode conjurá-la\ncomo uma Ação Bônus e pode tornar a mão espectral Invisível. Você pode controlar a mão como uma\nAção Bônus e, através dela, pode realizar testes de\nDestreza (Prestidigitação)."
    },
    {
      "level": 9,
      "name": "Emboscada Mágica",
      "description": "Se você tem a condição de Invisível quando conjura\numa magia em uma criatura, ela tem Desvantagem\nem qualquer salvaguarda que fizer contra a magia no\nmesmo turno."
    },
    {
      "level": 13,
      "name": "Trapaceiro Versátil",
      "description": "Você adquire a capacidade de distrair os alvos com\nsuas Mãos Mágicas. Ao usar a opção Golpe Astuto em\nseu Ataque em uma criatura, você também pode usar\nessa opção em outra criatura a até 1,5 metro da mão\nespectral."
    },
    {
      "level": 17,
      "name": "Ladrão de Magias",
      "description": "Você adquire a capacidade de roubar magicamente\no conhecimento de como conjurar uma magia de\noutro conjurador.\nImediatamente após uma criatura conjurar\numa magia que tenha como alvo você ou a inclua\nem sua área de efeito, você pode executar uma\nReação para forçá-la a realizar uma salvaguarda\nde Inteligência, com CD equivalente à sua CD para\nevitar sua magia. Se a criatura falhar, você nega o\nefeito da magia contra si e rouba seu conhecimento\nse a magia for de 1º círculo ou de um círculo que\nvocê possa conjurar (não precisa ser uma magia\nde Mago). Por 8 horas, você a terá preparada,\ne a criatura não poderá conjurá-la durante esse\nperíodo.\nApós roubar uma magia com essa característica,\nvocê não pode usar esta característica novamente até\ncompletar um Descanso Longo."
    }
  ]
}
