{
  "$schema": "../../schema/subclass.schema.json",
  "id": "gloom-stalker",
  "classId": "ranger",
  "name": "Vigilante das Sombras",
  "source": {
    "book": "Livro do Jogador 2024",
    "language": "pt-BR",
    "chapter": 3,
    "chapterTitle": "Classes de Personagem",
    "pdfPath": "doc/livro-jogador.pdf",
    "pdfPages": [55, 182],
    "extractedAt": "2026-06-25T01:13:29.372Z"
  },
  "tagline": "Persiga inimigos nas trevas",
  "summary": "Perseguir inimigos que se escondem nas trevas.",
  "description": "Vigilantes das Sombras estão nos lugares mais sombrios, empunhando magia extraída do Sombral para\ncombater inimigos que se escondem na escuridão.",
  "features": [
    {
      "level": 3,
      "name": "Emboscador das Sombras",
      "description": "Você dominou a arte de criar emboscadas temíveis,\nconcedendo-lhe os seguintes benefícios.\nBônus de Iniciativa. Ao jogar Iniciativa, pode adicionar\nseu modificador de Sabedoria à jogada.\nGolpe Terrível. Ao atacar e atingir uma criatura\ncom uma arma, você pode causar 2d6 pontos de dano\nPsíquico adicional. Você pode usar este benefício uma\nvez por turno e um número de vezes igual ao seu modificador de Sabedoria (mínimo de uma vez) e restaura\ntodos os usos gastos ao completar um Descanso Longo.\nImpulso do Emboscador. No início do seu primeiro\nturno de cada combate, seu Deslocamento aumenta em\n3 metros até o final deste turno."
    },
    {
      "level": 3,
      "name": "Magias do Vigilante das Sombras",
      "description": "Ao atingir um nível de Guardião detalhado na tabela\nMagias do Vigilante das Sombras, você tem a lista de\nmagias sempre preparadas.\nMagias do Vigilante das Sombras\nNível de Guardião Magias\n3 Disfarçar-se\n5 Corda Extradimensional\n9 Medo\n13 Invisibilidade Maior\n17 Similaridade"
    },
    {
      "level": 3,
      "name": "Visão Umbrosa",
      "description": "Você adquire Visão no Escuro com um alcance de\n18 metros. Se você já tem Visão no Escuro, o alcance\naumenta em 18 metros.\nVocê também se torna capaz de escapar de criaturas\nque utilizem Visão no Escuro. Enquanto estiver inteiramente na Escuridão, você tem a condição Invisível\npara qualquer criatura que dependa da Visão no Escuro\npara vê-lo nessa Escuridão."
    },
    {
      "level": 7,
      "name": "Mente de Ferro",
      "description": "Você desenvolveu a capacidade de resistir a poderes\nque alteram a mente. Você adquire proficiência em\nsalvaguardas de Sabedoria. Se você já tem essa proficiência, adquire proficiência em salvaguardas de Carisma\nou Inteligência (à sua escolha)."
    },
    {
      "level": 11,
      "name": "Torrente do Vigilante",
      "description": "O dano psíquico do seu Golpe Terrível se torna 2d8.\nAlém disso, ao usar o efeito Golpe Terrível da sua\ncaracterística Emboscador das Sombras, você pode\ncausar um dos seguintes efeitos adicionais.\nGolpe Repentino. Você pode realizar outro ataque\ncom a mesma arma contra uma criatura diferente que\nesteja a até 1,5 metro do alvo original e que esteja dentro do alcance da arma.\nMedo em Massa. O alvo e cada criatura a até 3\nmetros dele deve realizar uma salvaguarda de Sabedoria\ncontra a CD para evitar sua magia. Ao falhar, uma\ncriatura tem a condição Amedrontado até o início do\nseu próximo turno."
    },
    {
      "level": 15,
      "name": "Esquiva Sombria",
      "description": "Quando uma criatura realiza uma jogada de ataque\ncontra você, você pode executar uma Reação para\nimpor Desvantagem nessa jogada. Se o ataque acertar\nou errar, você pode se teleportar até 9 metros para um\nespaço desocupado à sua vista."
    }
  ]
}
