{
  "$schema": "../../schema/subclass.schema.json",
  "id": "stars",
  "classId": "druid",
  "name": "Círculo das Estrelas",
  "source": {
    "book": "Livro do Jogador 2024",
    "language": "pt-BR",
    "chapter": 3,
    "chapterTitle": "Classes de Personagem",
    "pdfPath": "doc/livro-jogador.pdf",
    "pdfPages": [
      55,
      182
    ],
    "extractedAt": "2026-06-25T01:13:29.372Z"
  },
  "tagline": "Obtenha poderes em forma estelar",
  "summary": "Obter poderes em uma forma estelar.",
  "description": "O Círculo das Estrelas segue os padrões celestiais desde tempos imemoriais, descobrindo segredos ocultos\nentre as constelações. Ao compreender esses segredos,\nos druidas deste círculo buscam dominar os poderes do\ncosmos.",
  "features": [
    {
      "level": 3,
      "name": "Forma Estrelada",
      "description": "Como uma Ação Bônus, você pode gastar um uso de\nsua característica Forma Selvagem para assumir uma\nforma estrelada em vez de multimorfar.\nEnquanto em sua forma estrelada, você mantém suas\nestatísticas de jogo, mas seu corpo se torna luminoso,\ncom articulações que brilham como estrelas e linhas\nbrilhantes conectando-as, como em um mapa estelar.\nEssa forma emite Luz Plena em um raio de 3 metros e\nMeia-luz por mais 3 metros. A forma dura 10 minutos\ne encerra se você a dispensar (nenhuma ação é necessária), ter a condição Incapacitado ou se você usar essa\ncaracterística novamente.\nSempre que você assumir sua forma estrelada, escolha qual das constelações a seguir brilha em seu corpo;\nsua escolha concede certos benefícios enquanto estiver\nna forma.\nArqueiro. Uma constelação de um arqueiro aparece\nem você. Ao ativar e nos turnos subsequentes como\numa Ação Bônus, você pode realizar um ataque mágico\nà distância, disparando uma flecha luminosa que atinge\numa criatura a até 18 metros. Em caso de acerto, o\nataque causa 1d8 pontos de dano Radiante + seu modificador de Sabedoria.\nDragão. Uma constelação de um dragão sábio aparece em você. Quando realizar um teste de Inteligência\nou Sabedoria, ou uma salvaguarda de Constituição\npara manter a Concentração, você trata um resultado\n9 ou menor no d20 como um 10.\nTaça. Uma constelação de um cálice vivificante aparece em você. Sempre que você conjurar uma magia,\nusando um espaço de que restaure Pontos de Vida em\numa criatura, você ou outra criatura a até 9 metros de\nvocê pode restaurar Pontos de Vida iguais a 1d8 + seu\nmodificador de Sabedoria."
    },
    {
      "level": 3,
      "name": "Mapa Estelar",
      "description": "Você cria um mapa estelar como parte de seus estudos celestiais. Ele é um objeto Minúsculo, e você pode\nusá-lo como Foco de Conjuração para suas magias de\nDruida. Você determina sua forma jogando na tabela\nMapa Estelar ou escolhendo uma.\nEnquanto estiver segurando o mapa, você tem as magias Orientação e Raio Guia preparadas, e pode conjurar\nRaio Guia sem gastar um espaço de magia. Você pode\nconjurá-la dessa forma um número de vezes igual ao\nseu modificador de Sabedoria (mínimo de uma vez), e\nrestaura todos os usos gastos ao completar um Descanso Longo.\nSe você perder o mapa, pode realizar uma cerimônia\nde 1 hora para criar magicamente um substituto. Essa\ncerimônia pode ser realizada durante um Descanso\nCurto ou Longo e destrói o mapa anterior."
    },
    {
      "level": 6,
      "name": "Presságio Cósmico",
      "description": "Sempre que você completar um Descanso Longo, pode\nconsultar seu Mapa Estelar em busca de presságios\ne jogar um dado. Até completar o próximo Descanso\nLongo, você tem acesso a uma Reação especial com\nbase no número que obteve:\nProsperidade (par). Sempre que uma criatura à\nsua vista a até 9 metros de você realizar um Teste de\nD20, você pode executar uma Reação para jogar 1d6 e\nadicionar o resultado jogado ao total.\nInfortúnio (ímpar). Sempre que uma criatura à sua\nvista a até 9 metros de você realizar um Teste de D20,\nvocê pode executar uma Reação para jogar 1d6 e subtrair o resultado jogado do total.\nVocê pode usar essa Reação um número de vezes\nigual ao seu modificador de Sabedoria (mínimo de uma\nvez) e restaura todos os usos gastos ao completar um\nDescanso Longo."
    },
    {
      "level": 10,
      "name": "Constelações Cintilantes",
      "description": "As constelações da sua Forma Estrelada melhoram. O\n1d8 do Arqueiro e da Taça torna-se 2d8, e enquanto o\nDragão estiver ativo, você adquire um Deslocamento\nde Voo de 6 metros e pode pairar.\nAlém disso, no início de cada um dos seus turnos\nenquanto estiver na sua Forma Estrelada, você pode\nalterar qual constelação brilha em seu corpo."
    },
    {
      "level": 14,
      "name": "Repleto de Estrelas",
      "description": "Enquanto estiver em sua Forma Estrelada, você se\ntorna parcialmente incorpóreo e tem Resistência a\ndano Contundente, Cortante e Perfurante."
    }
  ]
}
