{
  "$schema": "../../schema/subclass.schema.json",
  "id": "evoker",
  "classId": "wizard",
  "name": "Evocador",
  "source": {
    "book": "Livro do Jogador 2024",
    "language": "pt-BR",
    "chapter": 3,
    "chapterTitle": "Classes de Personagem",
    "pdfPath": "doc/livro-jogador.pdf",
    "pdfPages": [
      55,
      182
    ],
    "extractedAt": "2026-06-25T01:13:29.372Z"
  },
  "tagline": "Crie efeitos explosivos",
  "summary": "Criar efeitos explosivos.",
  "description": "Seus estudos se concentram em magia que cria poderosos efeitos elementais, como frio intenso, chamas\nabrasadoras, trovões ensurdecedores, relâmpagos\ncrepitantes e ácido corrosivo. Alguns Evocadores\natuam em forças militares, servindo como artilharia\npara atacar exércitos à distância. Outros utilizam seus\npoderes para proteção, enquanto alguns buscam benefício pessoal.",
  "features": [
    {
      "level": 3,
      "name": "Truque Potente",
      "description": "Seus truques que causam dano afetam até criaturas\nque evitam os efeitos deles. Ao conjurar um truque em\numa criatura e errar o ataque ou o alvo ser bem-sucedido na salvaguarda contra o truque, ele sofre metade\ndo dano (se houver), mas não sofre efeitos adicionais\ndo truque."
    },
    {
      "level": 3,
      "name": "Versado em Evocação",
      "description": "Escolha duas magias de Mago da escola de Evocação,\ncada uma deve ser de 2º círculo ou inferior, e adicione-\n-as gratuitamente ao seu livro de magias.\nAlém disso, ao adquirir acesso a um novo círculo de\nespaços de magia nesta classe, você pode adicionar gratuitamente uma magia de Mago da escola de Evocação\nao seu livro de magias. A magia escolhida deve ser de\num círculo para o qual você tenha espaços de magia."
    },
    {
      "level": 6,
      "name": "Esculpir Magias",
      "description": "Você pode criar zonas de segurança nos efeitos das\nsuas evocações. Ao conjurar uma magia de Evocação\nque afeta criaturas à sua vista, você pode escolher um\nnúmero delas igual a 1 mais o círculo da magia. Criaturas escolhidas são bem-sucedidas automaticamente em\nsuas salvaguardas e não sofrem dano se normalmente\nsofreriam metade do dano em caso de sucesso."
    },
    {
      "level": 10,
      "name": "Evocação Potencializada",
      "description": "Ao conjurar uma magia de Mago da escola de Evocação, você pode adicionar seu modificador de Inteligência a uma jogada de dano dessa magia."
    },
    {
      "level": 14,
      "name": "Sobrecarga",
      "description": "Você pode aumentar o poder de suas magias. Ao conjurar uma magia de Mago que cause dano com um espaço de magia de 1º a 5º círculo, você pode causar dano\nmáximo com essa magia no turno no qual a conjurar.\nAo fazer isso pela primeira vez, você não sofre\nnenhum efeito adverso. Se usar esta característica novamente antes de completar um Descanso Longo, você\nsofre 2d12 pontos de dano Necrótico para cada círculo\ndo espaço de magia imediatamente após conjurá-la.\nEsse dano ignora Resistência e Imunidade.\nToda vez que você usa esta característica novamente\nantes de completar um Descanso Longo, o dano Necrótico por círculo de magia aumenta em 1d12."
    }
  ]
}
