{
  "$schema": "../../schema/subclass.schema.json",
  "id": "life",
  "classId": "cleric",
  "name": "Domínio da Vida",
  "source": {
    "book": "Livro do Jogador 2024",
    "language": "pt-BR",
    "chapter": 3,
    "chapterTitle": "Classes de Personagem",
    "pdfPath": "doc/livro-jogador.pdf",
    "pdfPages": [
      55,
      182
    ],
    "extractedAt": "2026-06-25T01:13:29.372Z"
  },
  "tagline": "Preserve a força vital",
  "summary": "Ser um mestre da cura.",
  "description": "O Domínio da Vida se concentra na energia positiva que ajuda a sustentar toda a vida no multiverso.\nOs clérigos que acessam este domínio são mestres\nda cura, usando essa força vital para curar muitas\nferidas.\nA existência deste domínio repousa na energia\npositiva que o envolve, atraindo Clérigos de várias\ntradições religiosas. Está especialmente conectado\na divindades agrícolas, deuses da cura e resistência,\nalém de entidades do lar e da comunidade. Ordens religiosas voltadas para a cura também buscam a magia\ndeste domínio.",
  "features": [
    {
      "level": 3,
      "name": "Magias de Domínio da Vida",
      "description": "Sua conexão com este domínio divino garante que\nvocê sempre tenha certas magias preparadas. Ao\natingir um nível de Clérigo especificado na tabela Magias de Domínio da Vida, você sempre tem as magias\nlistadas preparadas.\nMagias de Domínio da Vida\nNível de Clérigo Magias Preparadas\n3 Auxílio, Bênção, Curar Ferimentos,\nRestauração Menor\n5 Palavra Curativa em Massa, Revivificar\n7 Aura de Vida, Proteção\nContra a Morte\n9 Curar Ferimentos em Massa,\nRestauração Maior"
    },
    {
      "level": 3,
      "name": "Discípulo da Vida",
      "description": "Ao conjurar uma magia com um espaço de magia que\nrestaura Pontos de Vida em uma criatura, essa criatura recupera Pontos de Vida adicionais no turno da\nconjuração. Os Pontos de Vida adicionais são iguais a\n2 mais o nível do espaço de magia."
    },
    {
      "level": 3,
      "name": "Preservar a Vida",
      "description": "Com uma ação Usar Magia, você exibe seu Símbolo\nSagrado e usa seu Canalizar Divindade para evocar\numa energia de cura que pode restaurar um número\nde Pontos de Vida igual a cinco vezes seu nível de\nClérigo. Escolha criaturas Sangrando a até 9 metros\nde você (que pode incluir você) e divida esses Pontos\nde Vida entre elas. Esta característica pode restaurar\numa criatura a não mais que a metade dos Pontos de\nVida máximo dela."
    },
    {
      "level": 6,
      "name": "Curandeiro Abençoado",
      "description": "Magias de cura que você conjurar nos outros também\no curam. Imediatamente após conjurar uma magia\ncom um espaço de magia que restaure Pontos de Vida\nem uma criatura que não seja você, você recupera\nPontos de Vida iguais a 2 mais o círculo do espaço de\nmagia."
    },
    {
      "level": 17,
      "name": "Cura Suprema",
      "description": "Ao usar uma magia ou Canalizar Divindade para\nrestaurar Pontos de Vida em uma criatura, não jogue\nos dados normalmente; em vez disso, utilize o maior\nresultado de cada dado. Por exemplo, ao restaurar\n2d6 Pontos de Vida, você restaura 12."
    }
  ]
}
