{
  "$schema": "../../schema/subclass.schema.json",
  "id": "elements",
  "classId": "monk",
  "name": "Combatente dos Elementos",
  "source": {
    "book": "Livro do Jogador 2024",
    "language": "pt-BR",
    "chapter": 3,
    "chapterTitle": "Classes de Personagem",
    "pdfPath": "doc/livro-jogador.pdf",
    "pdfPages": [55, 182],
    "extractedAt": "2026-06-25T01:13:29.372Z"
  },
  "tagline": "Maneje poder elemental",
  "summary": "Manejar poder elemental.",
  "description": "Os Combatentes dos Elementos aproveitam o poder\ndos Planos Elementais. Utilizando-se de seu foco\nsobrenatural, eles dominam momentaneamente a\nenergia do Caos Elemental para se fortalecer dentro e\nfora de batalha.",
  "features": [
    {
      "level": 3,
      "name": "Manipular Elementos",
      "description": "Você conhece a magia Elementalismo. Sabedoria é seu\natributo de conjuração para ela."
    },
    {
      "level": 3,
      "name": "Sintonia Elemental",
      "description": "No início do seu turno, você pode gastar 1 Ponto de\nFoco para imbuir-se de energia elemental. A energia\ndura 10 minutos ou até você ter a condição Incapacitado. Você adquire os seguintes benefícios enquanto\nesta característica estiver ativa.\nAtaques Elementais. Ao acertar com seu Ataque\nDesarmado, você pode causar com ele, à sua escolha,\ndano Ácido, Elétrico, Gélido, Ígneo ou Trovejante, em\nvez de seu tipo de dano normal. Ao causar um desses\ntipos de dano, você também pode forçar o alvo a realizar\numa salvaguarda de Força. Se ele falhar, você pode\nmovê-lo até 3 metros em sua direção ou para longe de\nvocê, enquanto a energia elemental gira em torno dele.\nExtensão. Ao realizar um Ataque Desarmado, seu\nalcance aumenta em 3 metros à medida que a energia\nelemental se estende por você."
    },
    {
      "level": 6,
      "name": "Explosão Elemental",
      "description": "Como uma ação Usar Magia, você pode gastar 2 Pontos\nde Foco para fazer com que energia elemental exploda\nem uma Esfera de 6 metros de raio centrada em\num ponto a até 36 metros de você. Escolha um tipo de\ndano: Ácido, Elétrico, Gélido, Ígneo ou Trovejante.\nCada criatura na Esfera deve realizar uma salvaguarda\nde Destreza. Se falhar, uma criatura sofre dano\ndo tipo escolhido igual a três jogadas de seus dados\nde Artes Marciais. Em caso de sucesso, uma criatura\nsofre metade do dano."
    },
    {
      "level": 11,
      "name": "Passo dos Elementos",
      "description": "Enquanto sua Sintonia Elemental estiver ativa, você\ntambém tem um Deslocamento de Natação e de Voo\nigual ao seu Deslocamento."
    },
    {
      "level": 17,
      "name": "Ápice Elemental",
      "description": "Enquanto sua Sintonia Elemental estiver ativa, você\ntambém adquire os seguintes benefícios.\nGolpes Potencializados. Uma vez em cada um dos\nseus turnos, você pode causar dano adicional a um\nalvo igual a uma jogada de seu dado de Artes Marciais\nao atingi-lo com um Ataque Desarmado. O dano adicional é do mesmo tipo causado por esse ataque.\nPasso Destrutivo. Ao usar seu Passo do Vento, seu\nDeslocamento aumenta em 6 metros até o final do turno.\nPela duração, qualquer criatura à sua escolha sofre\ndano igual a uma jogada de seu dado de Artes Marciais\nquando você entra em um espaço a até 1,5 metro\ndela. O tipo de dano fica à sua escolha, entre Ácido,\nElétrico, Gélido, Ígneo ou Trovejante. Uma criatura\npode sofrer esse dano apenas uma vez por turno.\nResistência a Dano. Você adquire Resistência a um\ndos seguintes tipos de dano à sua escolha: Ácido, Elétrico, Gélido, Ígneo ou Trovejante. No início de cada\num dos seus turnos, você pode alterar essa escolha."
    }
  ]
}
